<?xml version="1.0" encoding="UTF-8"?>
<!--
  ============LICENSE_START=======================================================
  openECOMP : SDN-C
  ================================================================================
  Copyright (C) 2017 AT&T Intellectual Property. All rights
  						reserved.
  ================================================================================
  Licensed under the Apache License, Version 2.0 (the "License");
  you may not use this file except in compliance with the License.
  You may obtain a copy of the License at
       http://www.apache.org/licenses/LICENSE-2.0
  Unless required by applicable law or agreed to in writing, software
  distributed under the License is distributed on an "AS IS" BASIS,
  WITHOUT WARRANTIES OR CONDITIONS OF ANY KIND, either express or implied.
  See the License for the specific language governing permissions and
  limitations under the License.
  ============LICENSE_END=========================================================
  -->


<service-logic xmlns="http://www.openecomp.org/sdnc/svclogic"
    xmlns:xsi="http://www.w3.org/2001/XMLSchema-instance"
    xsi:schemaLocation="http://www.openecomp.org/sdnc/svclogic ./svclogic.xsd"
    module="neutron" version="1.0.0">

    <method rpc="canCreateNetwork" mode="sync">
        <return status="success">
            <parameter name="error-code" value="200" />
        </return>
    </method>

    <method rpc="networkCreated" mode="sync">
        <switch test="`(length($network.segment[0].provider-physical-network) >= 5) and (substr($network.segment[0].provider-physical-network,0,5) == 'dvspg')`">
            <outcome value="true">
                <block>
                <set>
                  <parameter name="vlanlist" value="`$network.segment[0].provider-segmentation-id`"/>
                </set>
                <for index="i" start="1" end="`$network.num-segments`">
                  <set>
                    <parameter name="vlanlist" value="`$vlanlist+','+$network.segment[$i].provider-segmentation-id`"/>
                  </set>
                </for>

                </block>
            </outcome>
            <outcome value="Other">
                <return status="success">
                    <parameter name="error-code" value="200"/>
                </return>
            </outcome>
        </switch>
    </method>

</service-logic>
