<!--
  ============LICENSE_START=======================================================
  openECOMP : SDN-C
  ================================================================================
  Copyright (C) 2017 AT&T Intellectual Property. All rights
  							reserved.
  ================================================================================
  Licensed under the Apache License, Version 2.0 (the "License");
  you may not use this file except in compliance with the License.
  You may obtain a copy of the License at
       http://www.apache.org/licenses/LICENSE-2.0
  Unless required by applicable law or agreed to in writing, software
  distributed under the License is distributed on an "AS IS" BASIS,
  WITHOUT WARRANTIES OR CONDITIONS OF ANY KIND, either express or implied.
  See the License for the specific language governing permissions and
  limitations under the License.
  ============LICENSE_END=========================================================
-->

<service-logic xmlns="http://www.onap.org/sdnc/svclogic"
               xmlns:xsi="http://www.w3.org/2001/XMLSchema-instance"
               xsi:schemaLocation="http://www.onap.org/sdnc/svclogic ./svclogic.xsd" module="test" version="1" >

    <method rpc="forNode" mode="sync">
        <block>
            <for index="1" start="true" end="3"><configure adaptor="com.att.sdnctl.sli.adaptor.ncs.ncsAdaptor" key="SNIIR" activate="true"><parameter name="input.request-id" value="`$eipam-ip-block.request-id`"/><parameter name="input.source" value="SDNC"/><parameter name="input.ptnii-name" value="`$eipam-ip-block.ptnii-name`"/><parameter name="input.ip-address" value="`$eipam-ip-block.ip-address`"/><parameter name="input.mask" value="`$eipam-ip-block.prefix-length`"/><outcome value="success">
            </outcome><outcome value="Other">
            </outcome></configure></for>
        </block>
    </method>
</service-logic>

